{"alpha":0.05,"applicable_profiles":["dynamic-change","evidence-echo","independent-noise","shared-occlusion","time-skew"],"artifact_id":"cal_055d4597b16bce9e0c442d1a","class_quantiles":{"blocked":0.4845153347531551,"clear":0.011380204655128567},"dataset_sha256":"1759a8aed144ce44ea30435bcba49794b94244287aec6e2e8dd605caff7a1aca","git_commit":"85f2639e98d26753cb0f3ef690a9ee5aa6e019f4","max_noise_intensity":0.55,"min_noise_intensity":0.25,"schema_version":"purify.robotics.calibration.v1","seed_ranges":[{"end":31049,"start":31000}],"sensor_versions":["look-twice-rgbd-learned-v5/1"]}
